[
{"schema_version":"sko-026-directory-feedback-v1","feedback_id":"fb_cross_approve","feedback_batch_id":"batch_fixture","target_type":"crosswalk","target_id":"xw_aaaaaaaaaaaaaaaaaaaaaaaa","decision":"approve","reviewer":"synthetic-owner","decision_at":"2026-08-17T12:00:00Z","reason":"synthetic exact approval","source_review_file":"synthetic-review.csv","source_review_file_hash":"aaaaaaaaaaaaaaaaaaaaaaaaaaaaaaaaaaaaaaaaaaaaaaaaaaaaaaaaaaaaaaaa","related_batch_id":"batch-source","related_proposal_id":"proposal-source","crosswalk_id":"xw_aaaaaaaaaaaaaaaaaaaaaaaa","airtable_record_id":"recExact123","entity_id":"ent_a","relationship_type":"group","counting_entity_id":"ent_a","fingerprint_version":"airtable-profile-fingerprint-v1","prior_state_hash":"","supersedes_feedback_id":""},
{"schema_version":"sko-026-directory-feedback-v1","feedback_id":"fb_ready","feedback_batch_id":"batch_fixture","target_type":"readiness","target_id":"ent_a","decision":"directory_ready","reviewer":"synthetic-owner","decision_at":"2026-08-17T12:01:00Z","reason":"synthetic readiness","source_review_file":"synthetic-review.csv","source_review_file_hash":"aaaaaaaaaaaaaaaaaaaaaaaaaaaaaaaaaaaaaaaaaaaaaaaaaaaaaaaaaaaaaaaa","entity_id":"ent_a"},
{"schema_version":"sko-026-directory-feedback-v1","feedback_id":"fb_new_approve","feedback_batch_id":"batch_fixture","target_type":"new_profile_candidate","target_id":"npc_new","decision":"approve_future_creation","reviewer":"synthetic-owner","decision_at":"2026-08-17T12:02:00Z","reason":"synthetic future process approval","source_review_file":"synthetic-review.csv","source_review_file_hash":"aaaaaaaaaaaaaaaaaaaaaaaaaaaaaaaaaaaaaaaaaaaaaaaaaaaaaaaaaaaaaaaa","entity_id":"ent_new","counting_entity_id":"ent_new"}
]
